{
  "$schema": "https://json-schema.org/draft/2020-12/schema",
  "$id": "https://openrobot.org/schema/v0.1/listing.json",
  "title": "openRobot Listing v0.1",
  "description": "Offener, herstellerneutraler Datenstandard für Serviceroboter-Angebote (Kauf, Miete, Leasing, RaaS) im DACH-Raum. Kernprinzip: Jedes Angebot muss Betrag, Laufzeit, Serviceumfang und MwSt.-Status explizit machen — die Angaben, die im Markt heute fast nie zusammen veröffentlicht werden.",
  "type": "object",
  "required": [
    "schemaVersion",
    "robotClass",
    "make",
    "model",
    "condition",
    "compliance",
    "offers",
    "supplier"
  ],
  "additionalProperties": false,
  "properties": {
    "schemaVersion": { "const": "0.1" },
    "listingId": {
      "type": "string",
      "description": "Stabile ID des Anbieters für dieses Listing (für Updates/Idempotenz)",
      "maxLength": 100
    },
    "sourceSystem": { "type": "string", "maxLength": 100 },
    "createdAt": { "type": "string", "format": "date-time" },
    "updatedAt": { "type": "string", "format": "date-time" },

    "robotClass": {
      "type": "string",
      "description": "Neutrale Taxonomie; Reinigungsklassen sind in v0.1 voll spezifiziert, weitere Klassen sind zulässig und werden kuratiert",
      "enum": [
        "ScrubberDryer",
        "Vacuum",
        "Sweeper",
        "Combination",
        "Disinfection",
        "Delivery",
        "Inspection",
        "Security",
        "Humanoid",
        "Other"
      ]
    },
    "make": { "type": "string", "minLength": 1, "maxLength": 100 },
    "model": { "type": "string", "minLength": 1, "maxLength": 150 },
    "variant": {
      "type": "string",
      "maxLength": 150,
      "description": "Konfigurations-/Ausstattungsvariante (z. B. 'Pro', 'Gen. II eco', 'Walzenbürste'). Varianten NIE unter demselben listingId mischen."
    },
    "modelYear": { "type": "integer", "minimum": 2015, "maximum": 2035 },
    "condition": { "type": "string", "enum": ["New", "Demo", "Used", "Refurbished"] },
    "operatingHours": {
      "type": "number",
      "minimum": 0,
      "description": "Pflichtangabe-Empfehlung bei condition != New"
    },
    "serialNumber": { "type": "string", "maxLength": 100 },
    "manufacturerSku": { "type": "string", "maxLength": 100 },
    "gtin": { "type": "string", "pattern": "^[0-9]{8,14}$" },

    "summary": { "type": "string", "maxLength": 500 },
    "description": { "type": "string", "maxLength": 5000 },
    "highlights": { "type": "array", "items": { "type": "string", "maxLength": 200 }, "maxItems": 10 },

    "capabilities": { "$ref": "#/$defs/CleaningCapabilities" },
    "connectivity": { "$ref": "#/$defs/Connectivity" },
    "compliance": { "$ref": "#/$defs/Compliance" },
    "offers": {
      "type": "array",
      "minItems": 1,
      "maxItems": 20,
      "items": { "$ref": "#/$defs/Offer" }
    },
    "media": { "$ref": "#/$defs/Media" },
    "supplier": { "$ref": "#/$defs/Supplier" },
    "location": { "$ref": "#/$defs/Location" },

    "extensions": {
      "type": "object",
      "description": "Plattform-/anbieterspezifische Zusatzdaten außerhalb des Standards"
    }
  },

  "$defs": {
    "CleaningCapabilities": {
      "type": "object",
      "additionalProperties": false,
      "properties": {
        "cleaningWidthCm": { "type": "number", "exclusiveMinimum": 0, "maximum": 300 },
        "areaPerformanceTheoreticalM2h": {
          "type": "number",
          "exclusiveMinimum": 0,
          "description": "Arbeitsbreite × Maximalgeschwindigkeit. NIE als praktischer Wert ausgeben."
        },
        "areaPerformancePracticalM2h": {
          "type": "number",
          "exclusiveMinimum": 0,
          "description": "Herstellerangabe unter realen Bedingungen (Wenden, Hindernisse, Ladepausen). Erfahrungswert: 30–50 % des theoretischen Werts."
        },
        "runtimeMinutes": { "type": "number", "exclusiveMinimum": 0, "maximum": 1440 },
        "chargingTimeMinutes": { "type": "number", "exclusiveMinimum": 0, "maximum": 1440 },
        "freshWaterTankL": { "type": "number", "minimum": 0 },
        "wasteWaterTankL": { "type": "number", "minimum": 0 },
        "dustbinL": { "type": "number", "minimum": 0 },
        "navigationTypes": {
          "type": "array",
          "items": {
            "type": "string",
            "enum": ["Lidar2D", "Lidar3D", "Camera", "DepthCamera", "Ultrasonic", "Gps", "MagneticTape", "Other"]
          }
        },
        "dockingStation": { "type": "boolean" },
        "autonomousWaterExchange": { "type": "boolean" },
        "suitableEnvironments": {
          "type": "array",
          "items": {
            "type": "string",
            "enum": ["Office", "Retail", "Logistics", "Industry", "Healthcare", "Hospitality", "Education", "Transport", "Outdoor"]
          }
        },
        "minAreaM2": { "type": "number", "minimum": 0 },
        "maxAreaM2": { "type": "number", "exclusiveMinimum": 0 },
        "climbAbilityPct": { "type": "number", "minimum": 0, "maximum": 30 },
        "noiseDb": { "type": "number", "minimum": 0, "maximum": 120 },
        "weightKg": { "type": "number", "exclusiveMinimum": 0 },
        "dimensions": { "$ref": "#/$defs/Dimensions" },
        "features": { "type": "array", "items": { "type": "string", "maxLength": 200 }, "maxItems": 40 }
      }
    },

    "Dimensions": {
      "type": "object",
      "additionalProperties": false,
      "properties": {
        "lengthMm": { "type": "number", "exclusiveMinimum": 0 },
        "widthMm": { "type": "number", "exclusiveMinimum": 0 },
        "heightMm": { "type": "number", "exclusiveMinimum": 0 }
      }
    },

    "Connectivity": {
      "type": "object",
      "additionalProperties": false,
      "properties": {
        "vda5050": { "type": "boolean", "description": "VDA-5050-Anbindung (Fleet-Manager ↔ AMR)" },
        "fleetApi": { "type": "boolean", "description": "Herstellereigene Flotten-/Reporting-API vorhanden" },
        "apiDocsUrl": { "type": "string", "format": "uri" },
        "offlineCapable": { "type": "boolean", "description": "Betrieb ohne Cloud-Anbindung möglich" }
      }
    },

    "Compliance": {
      "type": "object",
      "required": ["ceMarking"],
      "additionalProperties": false,
      "properties": {
        "ceMarking": { "type": "boolean" },
        "declarationOfConformityUrl": { "type": "string", "format": "uri" },
        "conformityBasis": {
          "type": "string",
          "enum": ["MRL-2006-42-EC", "MVO-2023-1230"],
          "description": "Rechtsgrundlage des Inverkehrbringens; ab 20.01.2027 nur noch MVO-2023-1230 für Neugeräte"
        },
        "standards": {
          "type": "array",
          "items": { "type": "string", "maxLength": 100 },
          "description": "z. B. 'EN IEC 63327:2021', 'IEC 60335-2-72'"
        },
        "operatingManualDeUrl": {
          "type": "string",
          "format": "uri",
          "description": "Betriebsanleitung in deutscher Sprache (Pflicht für DACH-Vermietung)"
        },
        "dataPrivacy": { "$ref": "#/$defs/DataPrivacyProfile" }
      }
    },

    "DataPrivacyProfile": {
      "type": "object",
      "additionalProperties": false,
      "description": "Sensorik-/Datenfluss-Profil für die DSGVO-Bewertung des Betreibers",
      "properties": {
        "camerasOnboard": { "type": "boolean" },
        "recordsVideo": { "type": "boolean" },
        "onDeviceProcessingOnly": { "type": "boolean" },
        "cloudUpload": { "type": "boolean" },
        "cloudRegion": { "type": "string", "maxLength": 100 },
        "dataSheetUrl": { "type": "string", "format": "uri" }
      }
    },

    "Offer": {
      "type": "object",
      "required": ["offerType", "priceCents", "currency", "vatRate", "serviceScope"],
      "additionalProperties": false,
      "description": "Ein konkretes Angebot. Preise IMMER netto in Cent. Serviceumfang ist Pflicht — 'Leasing ab X €' ohne Service-Abgrenzung ist kein gültiges openRobot-Angebot.",
      "properties": {
        "offerType": { "type": "string", "enum": ["Purchase", "Rent", "Leasing", "RaaS", "DayRate", "PayPerUse"] },
        "priceCents": {
          "type": "integer",
          "minimum": 0,
          "description": "Netto-Preis in Cent (7210 € Monatsrate = 721000). Bei PayPerUse: Cent pro Einheit."
        },
        "currency": { "type": "string", "enum": ["EUR", "CHF"] },
        "vatRate": { "type": "number", "minimum": 0, "maximum": 30, "description": "Anzuwendender USt.-Satz in Prozent (DE 19, AT 20, CH 8.1)" },
        "isStartingPrice": { "type": "boolean", "description": "true = 'ab'-Preis, abhängig von Laufzeit/Bonität/Konfiguration" },
        "billingPeriod": { "type": "string", "enum": ["Once", "Day", "Week", "Month", "Year", "PerSquareMeter"] },
        "minTermMonths": { "type": "integer", "minimum": 0, "maximum": 120 },
        "noticePeriodMonths": { "type": "integer", "minimum": 0, "maximum": 24 },
        "autoRenewal": { "type": "boolean" },
        "setupFeeCents": { "type": "integer", "minimum": 0, "description": "Einmalige Einrichtung/Installation/Mapping, netto in Cent" },
        "deliveryFeeCents": { "type": "integer", "minimum": 0 },
        "buyoutOptionCents": { "type": "integer", "minimum": 0, "description": "Kaufoption am Laufzeitende (Mietkauf), netto in Cent" },
        "serviceScope": { "$ref": "#/$defs/ServiceScope" },
        "availability": { "$ref": "#/$defs/Availability" },
        "validUntil": { "type": "string", "format": "date" },
        "notes": { "type": "string", "maxLength": 1000 }
      },
      "allOf": [
        {
          "if": {
            "properties": { "offerType": { "enum": ["Rent", "Leasing", "RaaS"] } }
          },
          "then": { "required": ["billingPeriod", "minTermMonths"] }
        },
        {
          "if": { "properties": { "offerType": { "const": "DayRate" } } },
          "then": { "properties": { "billingPeriod": { "const": "Day" } }, "required": ["billingPeriod"] }
        },
        {
          "if": { "properties": { "offerType": { "const": "PayPerUse" } } },
          "then": { "properties": { "billingPeriod": { "const": "PerSquareMeter" } }, "required": ["billingPeriod"] }
        }
      ]
    },

    "ServiceScope": {
      "type": "object",
      "required": ["level"],
      "additionalProperties": false,
      "description": "Explizite Service-Abgrenzung des Angebots. level=Full nur, wenn Wartung, Reparaturen UND Ersatzgerät enthalten sind.",
      "properties": {
        "level": { "type": "string", "enum": ["Full", "Partial", "None"] },
        "maintenance": { "type": "boolean", "description": "Regelmäßige Wartung enthalten" },
        "repairs": { "type": "boolean" },
        "wearParts": { "type": "boolean", "description": "Verschleißteile (Bürsten, Sauglippen, Filter) enthalten" },
        "consumables": { "type": "boolean", "description": "Verbrauchsmaterial (Pads, Reinigungsmittel) enthalten" },
        "replacementDevice": { "type": "boolean", "description": "Ersatzgerät bei Ausfall (SLA)" },
        "replacementSlaHours": { "type": "integer", "minimum": 1, "maximum": 336 },
        "onSiteSupport": { "type": "boolean" },
        "remoteMonitoring": { "type": "boolean" },
        "softwareUpdates": { "type": "boolean" },
        "installation": { "type": "boolean", "description": "Inbetriebnahme/Mapping/Schulung enthalten" },
        "statutoryInspection": { "type": "boolean", "description": "Jährliche UVV-/DGUV-V3-Prüfung enthalten" },
        "insurance": { "type": "boolean", "description": "Maschinenbruch-/Haftpflichtdeckung enthalten" },
        "notes": { "type": "string", "maxLength": 500 }
      }
    },

    "Availability": {
      "type": "object",
      "additionalProperties": false,
      "properties": {
        "inStock": { "type": "boolean" },
        "leadTimeDays": { "type": "integer", "minimum": 0, "maximum": 365 },
        "serviceRegions": {
          "type": "array",
          "items": { "type": "string", "maxLength": 10 },
          "description": "ISO-3166-1/2-Codes (DE, AT, CH, DE-BY …) oder PLZ-Präfixe"
        }
      }
    },

    "Media": {
      "type": "object",
      "additionalProperties": false,
      "properties": {
        "images": {
          "type": "array",
          "maxItems": 20,
          "items": {
            "type": "object",
            "required": ["url"],
            "additionalProperties": false,
            "properties": {
              "url": { "type": "string", "format": "uri" },
              "type": { "type": "string", "enum": ["Product", "InUse", "Detail", "Datasheet"] }
            }
          }
        },
        "brochureUrl": { "type": "string", "format": "uri" },
        "videoUrl": { "type": "string", "format": "uri" }
      }
    },

    "Supplier": {
      "type": "object",
      "required": ["name", "countryCode"],
      "additionalProperties": false,
      "properties": {
        "name": { "type": "string", "minLength": 1, "maxLength": 200 },
        "legalName": { "type": "string", "maxLength": 200 },
        "supplierType": { "type": "string", "enum": ["Manufacturer", "Distributor", "Dealer", "Integrator", "RentalCompany"] },
        "website": { "type": "string", "format": "uri" },
        "email": { "type": "string", "format": "email" },
        "phone": { "type": "string", "maxLength": 50 },
        "countryCode": { "type": "string", "pattern": "^[A-Z]{2}$" },
        "vatId": { "type": "string", "maxLength": 20, "description": "USt-IdNr. — Basis der Anbieter-Verifizierung" }
      }
    },

    "Location": {
      "type": "object",
      "additionalProperties": false,
      "properties": {
        "countryCode": { "type": "string", "pattern": "^[A-Z]{2}$" },
        "postalCode": { "type": "string", "maxLength": 10 },
        "city": { "type": "string", "maxLength": 100 }
      }
    }
  }
}
